{"as_of_time":"2026-01-01T00:00:00Z","calendar_id":"cal.equities.2026q1","calendar_schema_version":1,"created_at":"2026-01-01T00:00:00Z","quarantined_events_count":0,"scheduled_events":[{"category":"EARNINGS","event_id":"ev.earn.aapl.2026q1","instrument_id":"inst.us_equity.aapl","scheduled_time":"2026-01-22T21:30:00Z","source_evidence":"cal.ir.aapl.2026q1","status":"SCHEDULED"}],"timezone":"America/New_York"}
